{
  "displayName": "Ski Strength",
  "startDate": "2026-09-28",
  "periods": [
    {
      "n": 1,
      "phase": "Normalize + test",
      "lengthDays": 7,
      "deload": false
    },
    {
      "n": 2,
      "phase": "Foundation",
      "lengthDays": 7,
      "deload": false
    },
    {
      "n": 3,
      "phase": "Foundation",
      "lengthDays": 7,
      "deload": false
    },
    {
      "n": 4,
      "phase": "Foundation",
      "lengthDays": 7,
      "deload": false
    },
    {
      "n": 5,
      "phase": "Max strength + ME",
      "lengthDays": 7,
      "deload": false
    },
    {
      "n": 6,
      "phase": "Max strength + ME",
      "lengthDays": 7,
      "deload": false
    },
    {
      "n": 7,
      "phase": "Max strength + ME",
      "lengthDays": 7,
      "deload": false
    },
    {
      "n": 8,
      "phase": "Deload + retest",
      "lengthDays": 7,
      "deload": true
    },
    {
      "n": 9,
      "phase": "Power + conversion",
      "lengthDays": 7,
      "deload": false
    },
    {
      "n": 10,
      "phase": "Power + conversion",
      "lengthDays": 7,
      "deload": false
    },
    {
      "n": 11,
      "phase": "Power + conversion",
      "lengthDays": 7,
      "deload": false
    }
  ],
  "ongoingPeriod": {
    "phase": "In-season",
    "startDate": "2026-12-14"
  },
  "seedMaxes": {
    "squat": 240,
    "deadlift": null
  },
  "testDefinitions": [
    {
      "key": "squat",
      "label": "Back squat",
      "unit": "lb × reps",
      "kind": "load-reps-e1rm"
    },
    {
      "key": "deadlift",
      "label": "Deadlift",
      "unit": "lb × reps",
      "kind": "load-reps-e1rm"
    },
    {
      "key": "rfess",
      "label": "RFESS 8RM",
      "unit": "lb/DB",
      "kind": "max-value"
    },
    {
      "key": "bench",
      "label": "DB bench 8RM",
      "unit": "lb/DB",
      "kind": "max-value"
    },
    {
      "key": "row",
      "label": "Single-arm row 8RM",
      "unit": "lb",
      "kind": "max-value"
    },
    {
      "key": "pullup",
      "label": "Pull-up max",
      "unit": "reps",
      "kind": "max-value"
    },
    {
      "key": "broad",
      "label": "Broad jump",
      "unit": "in",
      "kind": "max-value"
    },
    {
      "key": "hopL",
      "label": "SL hop L",
      "unit": "in",
      "kind": "max-value"
    },
    {
      "key": "hopR",
      "label": "SL hop R",
      "unit": "in",
      "kind": "max-value"
    },
    {
      "key": "lathops",
      "label": "Lateral hops",
      "unit": "/30 s",
      "kind": "max-value"
    },
    {
      "key": "wallsit",
      "label": "Wall sit 90°",
      "unit": "s",
      "kind": "max-value"
    },
    {
      "key": "k2wL",
      "label": "Knee-to-wall L",
      "unit": "cm",
      "kind": "max-value"
    },
    {
      "key": "k2wR",
      "label": "Knee-to-wall R",
      "unit": "cm",
      "kind": "max-value"
    },
    {
      "key": "stanceL",
      "label": "SL stance L",
      "unit": "s",
      "kind": "max-value"
    },
    {
      "key": "stanceR",
      "label": "SL stance R",
      "unit": "s",
      "kind": "max-value"
    },
    {
      "key": "cphL",
      "label": "Copenhagen L",
      "unit": "s",
      "kind": "max-value"
    },
    {
      "key": "cphR",
      "label": "Copenhagen R",
      "unit": "s",
      "kind": "max-value"
    },
    {
      "key": "sideL",
      "label": "Side plank L",
      "unit": "s",
      "kind": "max-value"
    },
    {
      "key": "sideR",
      "label": "Side plank R",
      "unit": "s",
      "kind": "max-value"
    },
    {
      "key": "tib",
      "label": "Tib raises",
      "unit": "reps",
      "kind": "max-value"
    },
    {
      "key": "aet",
      "label": "AeT heart rate",
      "unit": "bpm",
      "kind": "max-value"
    },
    {
      "key": "bw",
      "label": "Body weight",
      "unit": "lb",
      "kind": "max-value"
    }
  ],
  "videos": {
    "hpc": "https://www.youtube.com/watch?v=efHjodEVf9w",
    "pc": "https://youtu.be/YG8M_-11C2A",
    "kot": "https://www.youtube.com/watch?v=j9Jy5RRMTrw",
    "rfess": "https://www.youtube.com/shorts/lG3MsPmEQQk",
    "spanish": "https://www.youtube.com/watch?v=-ksofnvkohI",
    "iso": "https://www.youtube.com/watch?v=M5ZuFnI5UvU",
    "cph": "https://www.youtube.com/watch?v=nhGK-DxiGBE",
    "cossack": "https://www.youtube.com/watch?v=W-KbaAOpMhM",
    "stepdown": "https://www.youtube.com/watch?v=KVrReQL7R9o",
    "skater": "https://www.youtube.com/shorts/7-Qfb881k7o",
    "nordic": "https://www.youtube.com/watch?v=Lgibr8od0yA",
    "slrdl": "https://www.catalystathletics.com/exercise/483/Single-Leg-Dumbbell-RDL/",
    "tib": "https://www.strengthlog.com/tibialis-raise/",
    "calf": "https://support.runna.com/en/articles/6379527-bent-knee-calf-raise-exercise-tutorial",
    "splitjump": "https://www.youtube.com/watch?v=72xY37N_Sww",
    "me": "https://uphillathlete.com/strength-training/at-home-muscular-endurance-workout-with-progression/",
    "k2w": "https://library.theprehabguys.com/vimeo-video/knee-to-wall-ankle-dorsiflexion-assessment/"
  },
  "circuits": {
    "meCircuit": "Box step-ups 18–20\" with pack 1 min/leg → jump squats 30 s → walking lunges 20 steps → split-squat jumps 30 s → wall sit at ski angle 60 s. No rest between stations, 3 min between rounds. Legs should burn before lungs do."
  },
  "activation": {
    "A": "Band Spanish squat 2×30 s · pogos 2×15 · empty-bar clean drills (RDL to mid-thigh, jump shrug, high pull) ×5 each",
    "B": "Copenhagen 1×15 s/side · lateral line hops 2×10 s · scap pull-ups ×8",
    "C": "Tib raise ×15 · bodyweight knee-over-toe split squat ×6/side · pogos 2×15"
  },
  "warmupTemplates": [
    {
      "key": "ergA",
      "ergName": "Assault bike",
      "erg": [
        [
          "0–3 min",
          "Easy, nasal breathing",
          "RPE 3"
        ],
        [
          "3–5 min",
          "Steady build",
          "RPE 5"
        ],
        [
          "5–7 min",
          "3 × (10 s hard / 30 s easy)",
          "RPE 8 spikes"
        ],
        [
          "7 min",
          "Easy to settle",
          "RPE 2"
        ]
      ],
      "mobility": "Ankle rocks 10/side · 90/90 hip switches ×8 · adductor rock-backs ×8/side",
      "activationGroup": "A"
    },
    {
      "key": "ergB",
      "ergName": "SkiErg",
      "erg": [
        [
          "0–3 min",
          "Easy, nasal breathing",
          "RPE 3"
        ],
        [
          "3–5 min",
          "Steady build",
          "RPE 5"
        ],
        [
          "5–7 min",
          "3 × (10 s hard / 30 s easy)",
          "RPE 8 spikes"
        ],
        [
          "7 min",
          "Easy to settle",
          "RPE 2"
        ]
      ],
      "mobility": "Ankle rocks 10/side · 90/90 hip switches ×8 · adductor rock-backs ×8/side",
      "activationGroup": "B"
    },
    {
      "key": "ergC",
      "ergName": "Assault bike",
      "erg": [
        [
          "0–3 min",
          "Easy, nasal breathing",
          "RPE 3"
        ],
        [
          "3–5 min",
          "Steady build",
          "RPE 5"
        ],
        [
          "5–7 min",
          "3 × (10 s hard / 30 s easy)",
          "RPE 8 spikes"
        ],
        [
          "7 min",
          "Easy to settle",
          "RPE 2"
        ]
      ],
      "mobility": "Ankle rocks 10/side · 90/90 hip switches ×8 · adductor rock-backs ×8/side",
      "activationGroup": "C"
    }
  ],
  "sessionTemplates": [
    {
      "key": "D1",
      "title": "Normalization",
      "shortLabel": "Day 1",
      "scope": {
        "type": "period",
        "n": 1
      },
      "warmupTemplate": "ergA",
      "noWarmupSpikes": false,
      "testDayNote": null,
      "isTest": false,
      "items": [
        {
          "name": "Hang power clean (light, crisp)",
          "rx": "5×3 RPE 6",
          "options": {
            "v": "hpc",
            "n": "Work up from PVC → empty bar: RDL to mid-thigh, jump shrug, high pull, then the clean."
          }
        },
        {
          "name": "Back squat",
          "rx": "2×5 RPE 6",
          "options": {
            "lift": "squat",
            "n": "Work up in sets of 5 to RPE 6, then 2 sets there."
          }
        },
        {
          "name": "Barbell RDL (both legs)",
          "rx": "3×8 RPE 6",
          "options": {
            "desc": "Romanian deadlift with a barbell, both feet on the floor: soft knees, push the hips back and slide the bar down to mid-shin, then stand up. Not the single-leg version — do every rep with both legs together, not alternating sides."
          }
        },
        {
          "name": "Split squat, bodyweight",
          "rx": "2×10/leg",
          "options": {
            "bw": 1,
            "v": "kot"
          }
        },
        {
          "name": "Push-ups",
          "rx": "3×10",
          "options": {
            "bw": 1
          }
        },
        {
          "name": "Strict pull-ups",
          "rx": "3×(max − 2)",
          "options": {
            "bw": 1
          }
        },
        {
          "name": "Knee-to-wall, left",
          "rx": "1×1",
          "options": {
            "bw": 1,
            "u": "cm",
            "norpe": 1,
            "t": "k2wL",
            "v": "k2w"
          }
        },
        {
          "name": "Knee-to-wall, right",
          "rx": "1×1",
          "options": {
            "bw": 1,
            "u": "cm",
            "norpe": 1,
            "t": "k2wR",
            "v": "k2w"
          }
        },
        {
          "name": "Single-leg stance eyes closed, left",
          "rx": "1×1",
          "options": {
            "bw": 1,
            "u": "s",
            "norpe": 1,
            "t": "stanceL",
            "n": "Max 60 s."
          }
        },
        {
          "name": "Single-leg stance eyes closed, right",
          "rx": "1×1",
          "options": {
            "bw": 1,
            "u": "s",
            "norpe": 1,